{
  "$schema": "https://json-schema.org/draft/2020-12/schema",
  "$id": "https://design-systems.pages.dev/schemas/design-system-metadata.schema.json",
  "title": "Design System Sidecar Metadata",
  "type": "object",
  "required": [
    "id",
    "slug",
    "name",
    "title",
    "concept",
    "inspiration",
    "summary",
    "tags",
    "themes",
    "locale",
    "status",
    "version",
    "searchText",
    "sections",
    "source",
    "updatedAt"
  ],
  "properties": {
    "id": { "type": "string", "pattern": "^[a-z0-9-]+$" },
    "slug": { "type": "string", "pattern": "^[a-z0-9-]+$" },
    "name": { "type": "string", "minLength": 1 },
    "title": { "type": "string", "minLength": 1 },
    "concept": { "type": "string", "minLength": 1 },
    "inspiration": { "type": "string", "minLength": 1 },
    "summary": { "type": "string", "minLength": 1 },
    "tags": {
      "type": "array",
      "minItems": 1,
      "items": { "type": "string", "minLength": 1 }
    },
    "themes": {
      "type": "array",
      "minItems": 1,
      "items": { "type": "string", "minLength": 1 }
    },
    "locale": { "type": "string", "enum": ["en"] },
    "status": { "type": "string", "enum": ["draft", "stable"] },
    "version": { "type": "string", "pattern": "^[0-9]+\\.[0-9]+\\.[0-9]+$" },
    "searchText": { "type": "string", "minLength": 1 },
    "sections": {
      "type": "array",
      "minItems": 1,
      "items": {
        "type": "object",
        "required": ["id", "label"],
        "properties": {
          "id": { "type": "string", "minLength": 1 },
          "label": { "type": "string", "minLength": 1 }
        },
        "additionalProperties": true
      }
    },
    "source": {
      "type": "object",
      "required": ["file", "repoPath"],
      "properties": {
        "file": { "type": "string", "pattern": "^[A-Za-z0-9_]+_Design_System\\.html$" },
        "repoPath": { "type": "string", "pattern": "^design-systems/.+\\.html$" }
      },
      "additionalProperties": false
    },
    "metadataPath": { "type": "string", "pattern": "^catalog/metadata/.+\\.json$" },
    "updatedAt": { "type": "string", "pattern": "^[0-9]{4}-[0-9]{2}-[0-9]{2}$" }
  },
  "additionalProperties": true
}
